File_ID,File,Entity,Code,Module,Closeness_Centrality
788,logic/layout/format/JournalAbbreviator,net/sf/jabref/logic/layout/format/JournalAbbreviator,repostioryLoader journalAbbreviationPreferences repostioryLoader journalAbbreviationPreferences format fieldText,logic,0.06526497515508504
789,logic/layout/format/LastPage,net/sf/jabref/logic/layout/format/LastPage,format pageParts,logic,0.06526497515508504
790,logic/layout/format/LatexToUnicodeFormatter,net/sf/jabref/logic/layout/format/LatexToUnicodeFormatter,formatter getName LaTeX to Unicode getKey latextounicode format inField getDescription Converts LaTeX encoding to Unicode characters. getExampleInput Monch,logic,0.10531528258578908
791,logic/layout/format/NameFormatter,net/sf/jabref/logic/layout/format/NameFormatter,DEFAULTFORMAT 1ff vv ll jj1ff vv ll jj ff vv ll jj parameter 1ff vv ll jj1ff vv ll jj ff vv ll jj format temp range toFormat al formats sb format ffvvlljj  parameters formatString aCase toFormat inParameters al parameters cases format fieldText setParameter parameter getNameFormatters 1ff vv ll jj1ff vv ll jj ff vv ll jj prefs result names formats,logic,0.06526497515508504
792,logic/layout/format/NameFormatterPreferences,net/sf/jabref/logic/layout/format/NameFormatterPreferences,nameFormatterKey nameFormatterValue nameFormatterKey nameFormatterValue getNameFormatterKey getNameFormatterValue,logic,0.11903786725260039
793,logic/layout/format/NoSpaceBetweenAbbreviations,net/sf/jabref/logic/layout/format/NoSpaceBetweenAbbreviations,format .spLu. fieldText,logic,0.06526497515508504
794,logic/layout/format/NotFoundFormatter,net/sf/jabref/logic/layout/format/NotFoundFormatter,notFound notFound getNotFound format Formatter not found 0 fieldText,logic,0.06526497515508504
795,logic/layout/format/Number,net/sf/jabref/logic/layout/format/Number,setArgument arg format fieldText,logic,0.06507127487896719
796,logic/layout/format/Ordinal,net/sf/jabref/logic/layout/format/Ordinal,NUMBERPATTERN format st nd rd th ordinalString ordinalString ordinalString result value ordinalString fieldText sb 1db,logic,0.06526497515508504
797,logic/layout/format/RTFChars,net/sf/jabref/logic/layout/format/RTFChars,LOGGER RTFCHARS format em emph textit it i textbf bf b Unknown command u emdash endash ldblquote rdblquote part combody command combody result command result part part command field sb currentCommand escaped incommand chars getPart text commandNestedInBraces count icount part res transformSpecialCharacter AE ae OE oe TH ss LnetsfjabreflogiclayoutformatRTFChars LnetsfjabreflogiclayoutLayoutFormatter,logic,0.06526497515508504
798,logic/layout/format/RemoveBrackets,net/sf/jabref/logic/layout/format/RemoveBrackets,format fieldText builder,logic,0.06613011293460448
799,logic/layout/format/RemoveBracketsAddComma,net/sf/jabref/logic/layout/format/RemoveBracketsAddComma,format fieldText builder,logic,0.06526497515508504
800,logic/layout/format/RemoveLatexCommandsFormatter,net/sf/jabref/logic/layout/format/RemoveLatexCommandsFormatter,format field sb currentCommand escaped incommand,logic,0.07959502919715121
801,logic/layout/format/RemoveTilde,net/sf/jabref/logic/layout/format/RemoveTilde,format fieldText result,logic,0.06526497515508504
802,logic/layout/format/RemoveWhitespace,net/sf/jabref/logic/layout/format/RemoveWhitespace,format fieldEntry sb,logic,0.06613011293460448
803,logic/layout/format/Replace,net/sf/jabref/logic/layout/format/Replace,regex replaceWith setArgument arg parts format fieldText,logic,0.06526497515508504
804,logic/layout/format/RisAuthors,net/sf/jabref/logic/layout/format/RisAuthors,arg format and sb authors setArgument arg,logic,0.06526497515508504
805,logic/layout/format/RisKeywords,net/sf/jabref/logic/layout/format/RisKeywords,format KW   keyword sb keywords,logic,0.06526497515508504
806,logic/layout/format/RisMonth,net/sf/jabref/logic/layout/format/RisMonth,format month,logic,0.06526497515508504
807,logic/layout/format/ToLowerCase,net/sf/jabref/logic/layout/format/ToLowerCase,format fieldText,logic,0.06526497515508504
808,logic/layout/format/ToUpperCase,net/sf/jabref/logic/layout/format/ToUpperCase,format fieldText,logic,0.06526497515508504
809,logic/layout/format/WrapContent,net/sf/jabref/logic/layout/format/WrapContent,before after setArgument arg parts format fieldText,logic,0.06526497515508504
810,logic/layout/format/WrapFileLinks,net/sf/jabref/logic/layout/format/WrapFileLinks,type string type value getType getString,logic,0.0650417104651194
811,logic/layout/format/XMLChars,net/sf/jabref/logic/layout/format/XMLChars,XMLCHARS ASCIITOXMLCHARS forceReplace format repl entry fieldText formattedFieldText firstFormat x0026 x2013 restFormat code entry toFormat fieldText buffer lt quot gt,logic,0.06586056084383843
812,logic/logging/Cache,net/sf/jabref/logic/logging/Cache,DEFAULTCAPACITY capacity queue cache cacheRefreshNeeded capacity get ensureCacheIsFresh add message truncateLog isCapacityExceeded,logic,0.07245646155615111
813,logic/logging/GuiAppender,net/sf/jabref/logic/logging/GuiAppender,CACHE name filter layout createAppender No name provided for GuiAppender name layout filter append event,logic,0.08866868158777727
814,logic/logging/JabRefLogger,net/sf/jabref/logic/logging/JabRefLogger,LOGGER setDebug Showing debug messages setLogLevelToDebugForJabRefClasses net.sf.jabref ctx config loggerConfig LnetsfjabreflogicloggingJabRefLogger,logic,0.04600679994148418
815,logic/msbib/BibTeXConverter,net/sf/jabref/logic/msbib/BibTeXConverter,MSBIBPREFIX msbib convert ID language language language author msbibbookauthor editor msbibtranslator msbibproducername msbibcomposer msbibconductor msbibperformer msbibwriter msbibdirector msbibcompiler msbibinterviewer msbibinterviewee msbibinventor msbibcounsel pages location organization msbibaccessed journaltitle month number result msField value field lcid month entry result fieldValues bibTexEntryType addAuthor and map type authors allAuthors parseSingleStandardNumber type bibtype standardNum map pattern matcher parseStandardNumber ISBN isbn ISSN issn LCCN lccn MRN mrnumber DOI doi standardNum map,logic,0.057292557658132674
816,logic/msbib/MSBibConverter,net/sf/jabref/logic/msbib/MSBibConverter,MSBIBPREFIX msbib BIBTEXPREFIX BIBTEX convert BIBTEXEntry SourceType booktitle pages msbibaccessed SoundRecording title Interview title issue number Patent number journal month year year language isbn issn lccn mrnumber address type type techreport Tech. rep. mastersthesis Masters thesis phdthesis Ph.D. dissertation unpublished unpublished InternetSite DocumentFromInternetSite title ElectronicSource Art Misc title author editor unicodeField field entry result msbibType sbNumber getAuthors AND iand name names authors result lambdaconvert9 result editors lambdaconvert8 result authors lambdaconvert7 MRN sbNumber mrnumber lambdaconvert6 LCCN sbNumber lccn lambdaconvert5 ISSN sbNumber issn lambdaconvert4 ISBN sbNumber isbn lambdaconvert3 LCID result lang lambdaconvert2 result accesed lambdaconvert1 result pages lambdaconvert0 result booktitle,logic,0.057292557658132674
817,logic/msbib/MSBibDatabase,net/sf/jabref/logic/msbib/MSBibDatabase,LOGGER NAMESPACE http,logic,0.06718453324788166
818,logic/msbib/MSBibEntry,net/sf/jabref/logic/msbib/MSBibEntry,fields authors bookAuthors editors translators producerNames composers conductors performers writers directors compilers interviewers interviewees inventors counsels pages standardNumber address conferenceName thesisType internetSiteTitle dateAccessed publicationTitle albumTitle broadcastTitle year month day number patentNumber journalName bibtexEntryType ADDRESSPATTERN DATEPATTERN bwsswsswb bwsswsswb entry getType SourceType getCiteKey Tag getXmlElementTextContent name entry value nodeLst populateFromXml SourceType Pages StandardNumber ConferenceName City StateProvince CountryRegion Patent PatentNumber JournalName Month InternetSiteTitle MonthAccessed DayAccessed YearAccessed Author key value node entry temp city state country addressBuffer monthAccessed dayAccessed yearAccessed sbDateAccesed nodeLst getAuthors Author BookAuthor Editor Translator ProducerName Composer Conductor Performer Writer Director Compiler Interviewer Interviewee Inventor Counsel authorsElem getSpecificAuthors NameList Person First Last Middle firstName lastName middleName name type authors result nodeLst person getEntryDom http,logic,0.05784665650423161
819,logic/msbib/MSBibEntryType,net/sf/jabref/logic/msbib/MSBibEntryType,ArticleInAPeriodical Book BookSection JournalArticle ConferenceProceedings Report SoundRecording Performance Art DocumentFromInternetSite InternetSite Film Interview Patent ElectronicSource Case Misc values valueOf LnetsfjabreflogicmsbibMSBibEntryType name ArticleInAPeriodical Book BookSection JournalArticle ConferenceProceedings Report SoundRecording Performance Art DocumentFromInternetSite InternetSite Film Interview Patent ElectronicSource Case Misc,logic,0.05045977198344062
820,logic/msbib/MSBibMapping,net/sf/jabref/logic/msbib/MSBibMapping,BIBTEXPREFIX BIBTEX MSBIBPREFIX msbib biblatexToMsBib getBibLaTeXEntryType Book BookSection JournalArticle ArticleInAPeriodical ConferenceProceedings Report Patent InternetSite msbibType defaultType entryTypeMapping getMSBibEntryType book inbook booklet incollection article inproceedings conference proceedings collection techreport manual mastersthesis phdthesis unpublished patent misc electronic online bibtexType entryTypeMapping getLCID language getLanguage english LCID getMSBibField bibtexFieldName getBibTeXField msbibFieldName bibtexkey Tag title Title year Year note Comments volume Volume language LCID edition Edition publisher Publisher booktitle BookTitle shorttitle ShortTitle note Comments chapter ChapterNumber issue Issue school Department institution Institution doi DOI url URL series BIBTEXSeries abstract BIBTEXAbstract keywords BIBTEXKeyWords crossref BIBTEXCrossRef howpublished BIBTEXHowPublished affiliation BIBTEXAffiliation contents BIBTEXContents copyright BIBTEXCopyright price BIBTEXPrice size BIBTEXSize intype BIBTEXInType paper BIBTEXPaper key BIBTEXKey msbibnumberofvolume NumberVolumes msbibperiodical PeriodicalTitle msbibday Day msbibaccessed Accessed msbibmedium Medium msbibrecordingnumber RecordingNumber msbibtheater Theater msbibdistributor Distributor msbibbroadcaster Broadcaster msbibstation Station msbibtype Type msbibcourt Court msbibreporter Reporter msbibcasenumber CaseNumber msbibabbreviatedcasenumber AbbreviatedCaseNumber msbibproductioncompany ProductionCompany,logic,0.05023316185092553
821,logic/msbib/PageNumbers,net/sf/jabref/logic/msbib/PageNumbers,freeform start end PAGEPATTERN pages parsePageNums pages matcher getDOMrepresentation extent unit page start end tmpStart tmpEnd textNode document result toString separator toString sds12sds,logic,0.05047710615451017
822,logic/msbib/PersonName,net/sf/jabref/logic/msbib/PersonName,givenName surname middleName name firstName middleName lastName parseName author authorMod endOfLastName names amountOfNames getGivenNames result getSurname setSurname lastName getFirstname setFirstname firstName getMiddlename setMiddlename middleName getFullname fullName toString,logic,0.05047710615451017
823,logic/net/ProxyAuthenticator,net/sf/jabref/logic/net/ProxyAuthenticator,getPasswordAuthentication .proxyHost .proxyPort .proxyUser .proxyPassword prot host port user password,logic,0.0009861932938856016
824,logic/net/ProxyPreferences,net/sf/jabref/logic/net/ProxyPreferences,useProxy hostname port useAuthentication username password useProxy hostname port useAuthentication username password isUseProxy getHostname getPort isUseAuthentication getUsername getPassword hashCode equals other obj,logic,0.11162323154844521
825,logic/net/ProxyRegisterer,net/sf/jabref/logic/net/ProxyRegisterer,register http.proxyHost http.proxyPort http.proxyUser http.proxyPassword java.net.useSystemProxies true proxySet true proxyPrefs,logic,0.060593376933457906
826,logic/net/URLDownload,net/sf/jabref/logic/net/URLDownload,LOGGER USERAGENT JabRef source parameters postData createURLDownloadWithBrowserUserAgent UserAgent Mozilla5.0 Windows NT 5.1 rv31.0 Gecko20100101 Firefox31.0 address downloader address UserAgent JabRef source getSource determineMimeType urlConnection addParameters key value setPostData postData openConnection Location entry wr newUrl connection status downloadToString Could not copy input output input encoding getCookieFromUrl Unable to convert download URL to URI cookieManager con copy line read in out encoding monitoredInputStream downloadToFile Could not copy input output input destination copy bytesRead buffer monitorInputStream in out monitorInputStream in toString URLDownloadsource LnetsfjabreflogicnetURLDownload,logic,0.07641624715879941
827,logic/net/URLUtil,net/sf/jabref/logic/net/URLUtil,URLEXP httpsftp,logic,0.05296623857819747
828,logic/openoffice/CitationEntry,net/sf/jabref/logic/openoffice/CitationEntry,refMarkName pageInfo context origPageInfo refMarkName context refMarkName context pageInfo refMarkName context pageInfo getPageInfo getRefMarkName pageInfoChanged compareTo other equals other hashCode getContext setPageInfo trim compareTo,logic,0.06041531075439232
829,logic/openoffice/OOBibStyle,net/sf/jabref/logic/openoffice/OOBibStyle,NONE LAYOUT PROPERTIES CITATION NAME JOURNALS values valueOf LnetsfjabreflogicopenofficeOOBibStyleBibStyleMode name NONE LAYOUT PROPERTIES CITATION NAME JOURNALS,logic,0.07244777567496347
830,logic/openoffice/OOPreFormatter,net/sf/jabref/logic/openoffice/OOPreFormatter,CHARS format dollar dollar command result part combody command combody result command result part part result argument result result command tag field finalResult sb currentCommand escaped incommand getHTMLTag textit it emph em textbf bf textsc underline sout texttt textsuperscript textsubscript smallcaps tt sup sub latexCommand result,logic,0.06715318255574546
831,logic/openoffice/OOUtil,net/sf/jabref/logic/openoffice/OOUtil,CHARSTRIKEOUT CharStrikeout CHARUNDERLINE CharUnderline PARASTYLENAME ParaStyleName CHARCASEMAP CharCaseMap CHARPOSTURE CharPosture CHARWEIGHT CharWeight CHARESCAPEMENTHEIGHT CharEscapementHeight CHARESCAPEMENT CharEscapement HTMLTAG UNIQUEFIERFIELD uniq insertFullReferenceAtCurrentLocation uniq uniq uniq uniq uniq text cursor layout parStyle entry database uniquefier oldUniqVal lText insertOOFormattedTextAtCurrentLocation LcomsunstartextXParagraphCursor LcomsunstarbeansXPropertySet ParaStyleName LnetsfjabreflogicopenofficeOOUtilFormatting b b i em i em tt tt smallcaps smallcaps sup sup sub sub u u s s ex ss tag text cursor lText parStyle parCursor props formatting piv insertParagraphBreak text cursor insertTextAtCurrentLocation LcomsunstarbeansXPropertySet CharWeight CharWeight CharPosture CharPosture CharCaseMap CharCaseMap CharEscapement CharEscapementHeight CharEscapement CharEscapementHeight CharEscapement CharEscapementHeight CharUnderline CharUnderline CharStrikeout CharStrikeout text cursor string formatting xCursorProps insertTextAtCurrentLocation LcomsunstartextXParagraphCursor LcomsunstarbeansXPropertySet ParaStyleName ex text cursor string parStyle parCursor props getProperty LcomsunstarbeansXPropertySet property props az,logic,0.06060830005661635
832,logic/openoffice/OpenOfficeFileSearch,net/sf/jabref/logic/openoffice/OpenOfficeFileSearch,fileSearchCanceled findWindowsProgramFilesDir ProgramFiles ProgramFilesx86 OpenOffice LibreOffice dir root dirs rootPath sourceList dirList progFiles findOSXProgramFilesDir Applications OpenOffice.org.app LibreOffice.app file dirList rootDir files resetFileSearch cancelFileSearch findFileInDirs dir dirList filename sofficeFiles findFileInDir file startDir filename files result,logic,0.06049149651826924
833,logic/openoffice/OpenOfficePreferences,net/sf/jabref/logic/openoffice/OpenOfficePreferences,preferences DEFAULTWINDOWSPATH CProgram FilesOpenOffice.org 4 WINDOWSEXECUTABLESUBPATH program WINDOWSEXECUTABLE soffice.exe WINDOWSJARSSUBPATH programclasses DEFAULTOSXPATH ApplicationsOpenOffice.org.app OSXEXECUTABLESUBPATH ContentsMacOS OSXEXECUTABLE soffice.bin OSXJARSSUBPATH ContentsResourcesjava LINUXEXECUTABLE soffice preferences updateConnectionParams ooPath execPath jarsPath checkAutoDetectedPaths ooJarsPath ooExecutablePath jurt.jar clearConnectionSettings ooPath ooExecutablePath ooJarsPath Cleared connection settings. getJarsPath ooJarsPath setJarsPath ooJarsPath path getExecutablePath ooExecutablePath setExecutablePath ooExecutablePath path getOOPath ooPath setOOPath ooPath path useAllDatabases useAllOpenBases setUseAllDatabases useAllOpenBases use syncWhenCiting syncOOWhenCiting setSyncWhenCiting syncOOWhenCiting sync showPanel showOOPanel setShowPanel showOOPanel show getExternalStyles ooExternalStyleFiles setExternalStyles ooExternalStyleFiles filenames getCurrentStyle ooBibliographyStyleFile clearCurrentStyle ooBibliographyStyleFile setCurrentStyle ooBibliographyStyleFile path,logic,0.07219203466148653
834,logic/openoffice/StyleLoader,net/sf/jabref/logic/openoffice/StyleLoader,LOGGER DEFAULTAUTHORYEARSTYLEPATH resourceopenofficedefaultauthoryear.jstyle DEFAULTNUMERICALSTYLEPATH resourceopenofficedefaultnumerical.jstyle internalStyleFiles preferences encoding layoutFormatterPreferences internalStyles externalStyles resourceopenofficedefaultauthoryear.jstyle resourceopenofficedefaultnumerical.jstyle preferences jabrefPreferences encoding getStyles result addStyleIfValid External style file already existing. Style with filename s is invalid Cannot find external style file Problem reading external style file newStyle filename loadExternalStyles Style with filename s is invalid Cannot find external style file Problem reading external style file style filename lists loadInternalStyles Problem reading internal style file filename storeExternalStyles style filenames removeStyle result style getUsedStyle style filename LnetsfjabreflogicopenofficeStyleLoader,logic,0.07175779685901143
835,logic/openoffice/UndefinedBibtexEntry,net/sf/jabref/logic/openoffice/UndefinedBibtexEntry,key author key getKey,logic,0.06064444594056574
836,logic/openoffice/UndefinedParagraphFormatException,net/sf/jabref/logic/openoffice/UndefinedParagraphFormatException,formatName formatName getFormatName,logic,0.07253491442387223
837,logic/protectedterms/ProtectedTermsList,net/sf/jabref/logic/protectedterms/ProtectedTermsList,LOGGER description termsList location internalList enabled description termList location internalList description termList location getDescription getTermList getLocation getTermListing compareTo otherList isInternalList setEnabled enabled isEnabled createAndWriteHeading newDescription addProtectedTerm term addProtectedTerm Problem adding protected term to list writer ioe term create equals otherList hashCode compareTo LnetsfjabreflogicprotectedtermsProtectedTermsList,logic,0.11532907634066747
838,logic/protectedterms/ProtectedTermsLoader,net/sf/jabref/logic/protectedterms/ProtectedTermsLoader,LOGGER mainList internalLists getInternalLists preferences update Protected terms resource   is no longer available. Protected terms resource   is no longer available. New protected terms resource   is available and enabled by default. Cannot find protected terms file Cannot find protected terms file filename filename filename filename filename preferences reloadProtectedTermsList Problem reloading protected terms file Problem with protected terms file  newList index list getProtectedTermsLists getProtectedTerms list result addProtectedTermsListFromFile Cannot find protected terms file fileName enabled readProtectedTermsListFromResource resource description enabled parser readProtectedTermsListFromFile Reading term list from file file enabled parser readProtectedTermsListFromFile Reading term list from file file encoding enabled parser removeProtectedTermsList termList addNewProtectedTermsList newDescription newLocation enabled resultingList addNewProtectedTermsList newDescription newLocation LnetsfjabreflogicprotectedtermsProtectedTermsLoader protectedtermsmonthsweekdays.terms Months and weekdays in English protectedtermscountriesterritories.terms Countries and territories in English protectedtermselectricalengineering.terms Electrical engineering terms,logic,0.11933174224343676
839,logic/protectedterms/ProtectedTermsParser,net/sf/jabref/logic/protectedterms/ProtectedTermsParser,terms description location LOGGER The text after the last line starting with  will be used readTermsFromResource LnetsfjabreflogicprotectedtermsProtectedTermsLoader Could not read protected terms from resource resourceFileName descriptionString url readTermsFromFile Could not read terms from file reader file readTermsFromFile Could not read terms from file reader stream file encoding readTermsList Could not read journal list from file line reader ex in addLine line getProtectTermsList enabled internal termList LnetsfjabreflogicprotectedtermsProtectedTermsParser,logic,0.09148678213745429
840,logic/protectedterms/ProtectedTermsPreferences,net/sf/jabref/logic/protectedterms/ProtectedTermsPreferences,enabledInternalTermLists enabledExternalTermLists disabledInternalTermLists disabledExternalTermLists enabledInternalTermLists enabledExternalTermLists disabledInternalTermLists disabledExternalTermLists getEnabledInternalTermLists getEnabledExternalTermLists getDisabledInternalTermLists getDisabledExternalTermLists,logic,0.11456703416605218
841,logic/remote/RemotePreferences,net/sf/jabref/logic/remote/RemotePreferences,port useRemoteServer port useRemoteServer getPort setPort port useRemoteServer setUseRemoteServer useRemoteServer isDifferentPort otherPort,logic,0.11112684958838803
842,logic/remote/RemoteUtil,net/sf/jabref/logic/remote/RemoteUtil,isUserPort portNumber,logic,0.060466079923093496
843,logic/remote/client/RemoteListenerClient,net/sf/jabref/logic/remote/client/RemoteListenerClient,LOGGER TIMEOUT sendToActiveJabRefInstance localhost jabref Cannot use port 0 for remote operation another application may be using it. Try specifying another port. Could not send args to the server at port port error identifier protocol socket args remoteServerPort LnetsfjabreflogicremoteclientRemoteListenerClient,logic,0.0009861932938856016
844,logic/remote/server/MessageHandler,net/sf/jabref/logic/remote/server/MessageHandler,handleMessage,logic,0.0773022215685845
845,logic/remote/server/RemoteListenerServer,net/sf/jabref/logic/remote/server/RemoteListenerServer,LOGGER BACKLOG ONESECONDTIMEOUT messageHandler serverSocket localhost messageHandler port run jabref RemoteListenerServer crashed protocol message socket ex closeServerSocket LnetsfjabreflogicremoteserverRemoteListenerServer,logic,0.0638928463722299
846,logic/remote/server/RemoteListenerServerLifecycle,net/sf/jabref/logic/remote/server/RemoteListenerServerLifecycle,remoteListenerServerThread LOGGER stop open Port is blocked result result messageHandler port result isOpen start isNotStartedBefore openAndStart messageHandler port close LnetsfjabreflogicremoteserverRemoteListenerServerLifecycle,logic,0.0953673096202535
847,logic/remote/server/RemoteListenerServerThread,net/sf/jabref/logic/remote/server/RemoteListenerServerThread,LOGGER server JabRef  Remote Listener Server on port messageHandler port interrupt Interrupting run LnetsfjabreflogicremoteserverRemoteListenerServerThread,logic,0.07646073366109143
848,logic/remote/shared/Protocol,net/sf/jabref/logic/remote/shared/Protocol,IDENTIFIER jabref LOGGER socket out in socket sendMessage message receiveMessage Connection timed out. ex result close LnetsfjabreflogicremotesharedProtocol,logic,0.05524017143450342
849,logic/search/DatabaseSearcher,net/sf/jabref/logic/search/DatabaseSearcher,query database LOGGER query database getMatches Search term Search failed illegal search expression matchEntries LnetsfjabreflogicsearchDatabaseSearcher,logic,0.04600679994148418
850,logic/search/SearchQuery,net/sf/jabref/logic/search/SearchQuery,query caseSensitive regularExpression rule description query caseSensitive regularExpression toString s s s isMatch entry isValid isContainsBasedSearch getCaseSensitiveDescription case sensitive case insensitive getRegularExpressionDescription regular expression plain text localize s s s getLocalizedCaseSensitiveDescription case sensitive case insensitive getLocalizedRegularExpressionDescription regular expression plain text isGrammarBasedSearch getQuery isCaseSensitive isRegularExpression getDescription getSearchWords,logic,0.09339763541631038
851,logic/search/SearchQueryHighlightListener,net/sf/jabref/logic/search/SearchQueryHighlightListener,highlightPattern,logic,0.07641624715879941
852,logic/search/SearchQueryHighlightObservable,net/sf/jabref/logic/search/SearchQueryHighlightObservable,eventBus pattern addSearchListener newListener removeSearchListener listener fireSearchlistenerEvent searchQuery reset update getPatternForWords word words useRegex isCaseSensitive joiner searchPattern,logic,0.07471924725698989
853,logic/search/rules/describer/ContainsAndRegexBasedSearchRuleDescriber,net/sf/jabref/logic/search/rules/describer/ContainsAndRegexBasedSearchRuleDescriber,regExp caseSensitive query caseSensitive regExp query getDescription This search contains entries in which any field contains the regular expression b0b This search contains entries in which any field contains the term b0b bsb s and pbr Hint To search specific fields only enter for examplepttauthorsmith and titleelectricaltt s s. s word unprocessedWords unprocessedWordsInHtmlFormat andSeparator words firstWord searchDescription caseSensitiveDescription genericDescription getCaseSensitiveDescription case sensitive case insensitive,logic,0.06311806529887418
