File_ID,File,Entity,Code,Module,Closeness_Centrality
1,Globals,net/sf/jabref/Globals,BUILDINFO REMOTELISTENER IMPORTFORMATREADER prefs journalAbbreviationLoader protectedTermsLoader keyPrefs focusListener fileUpdateMonitor streamEavesdropper getKeyPrefs startBackgroundTasks FileUpdateMonitor getFocusListener getFileUpdateMonitor getStreamEavesdropper,globals,0.12679964989701312
2,JabRefException,net/sf/jabref/JabRefException,localizedMessage LOGGER message message cause message localizedMessage message localizedMessage cause getLocalizedMessage No localized message exception message defined. Falling back to getMessage. LnetsfjabrefJabRefException,model,0.12362181260908432
3,JabRefExecutorService,net/sf/jabref/JabRefExecutorService,LOGGER INSTANCE executorService startedThreads timer timer execute command executeAndWait Problem executing command command future executeWithLowPriorityInOwnThread JabRef   low prio runnable name target thread executeInOwnThread thread executeWithLowPriorityInOwnThreadAndWait JabRef low prio runnable thread waitForThreadToFinish thread submit timerTask millisecondsDelay shutdownEverything thread lambdanew0 JabRef CachedThreadPool thread LnetsfjabrefguiundoUndoableInsertEntry,logic,0.10180415769654118
4,JabRefGUI,net/sf/jabref/JabRefGUI,LOGGER mainFrame bibDatabases isBlank failed toOpenTab focusedFile lastFocused argsDatabases isBlank checkForNewVersion manualExecution toBeIgnored currentVersion openWindow apple.laf.useScreenMenuBar true swing.aatext true awt.useSystemAAFontSettings lcd openLastEdited Initializing frame Connection error A local copy will be opened. Connection error windowMaximised html Error opening file 0. html Error opening file Finished adding panels pr parserResultIterator pr message pr pr pr panel first tabNumber openLastEditedDatabases lastEdited lastEdited Error opening file dbFile parsedDatabase fileName lastFiles isLoaded pr fileToOpen setLookAndFeel useDefaultLookAndFeel java.runtime.name OpenJDK There seem to be problems with OpenJDK and the default GTK LookFeel. Using Metal LF instead. Change to another LF with caution. lookAndFeel java.runtime.name OpenJDK lookAndFeel Unable to find the requested look and feel and thus the default one is used. Warning Unable to find requested look and feel Look and feel could not be set overrideDefaultFonts menuFontSize .font lookFeel lookFeel lnf lookFeel systemLookFeel font key fontSize defaults keys overrideDefaultFonts getMainFrame setMainFrame mainFrame LnetsfjabrefJabRefGUI,gui,0.09659703423328461
5,JabRefMain,net/sf/jabref/JabRefMain,LOGGER main args start language serializeSpecialFields timeStampField numericFields Arguments passed on to running JabRef instance. Shutting down. newline args preferences proxyPreferences customFormats layoutPreferences savePreferences remotePreferences argumentProcessor lambdastart1 argumentProcessor lambdamain0 args LnetsfjabrefJabRefMain,gui,0.0
6,cli/ArgumentProcessor,net/sf/jabref/cli/ArgumentProcessor,LOGGER cli parserResults startupMode noGUINeeded args startupMode getParserResults hasParserResults processArguments The output option depends on a valid input option. The output option depends on a valid import option. Finished export Cannot export preferences ex loaded exportMatches tablerefsabsbib Output file missing Usage Unknown export format Exporting Could not export file No search matches. formatName formatName ex formatName format loaded data searchTerm pr databaseContext dataBase searchPreferences query matches doAuxImport no baseBibTeXfile specified usage jabref aux infile.auxoutfile.bib baseBibTeXfile usageMsg loaded usageMsg importAndOpenFiles bib bibExtension pr aLeftOver filenameString loaded toImport generateAux bib Saving biblatexMode Warning The chosen encoding 0 could not encode the following characters Could not save file. no database generated prefs databaseWriter defaults session ex subName pr acl newBase notSavedMsg loaded data exportFile Saving biblatexMode Warning The chosen encoding 0 could not encode the following characters Could not save file. The output option depends on a valid import option. Exporting Unknown export format Could not export file prefs defaults databaseWriter session ex pr ex pr theFile databaseContext format loaded data importPreferences Cannot import preferences customFormats layoutPreferences savePreferences ex resetPreferences all Setting all preferences to default values. Unable to clear preferences. Unable to clear preferences Resetting preference key 0 Unknown preference key 0 key keys value automaticallySetFileLinks Automatically setting file links database parserResult loaded regenerateBibtexKeys Regenerating BibTeX keys according to metadata No meta data present in BIBfile. Cannot regenerate BibTeX keys entry database metaData parserResult loaded fetch Expected syntax for fetchname of fetcherquery The following fetchers are available Fetcher Could not find fetcher 0 The following fetchers are available Fetcher Running query 0 with fetcher 1. Please wait... Query 0 with fetcher 1 did not return any results. fetchCommand split engine fetchers fetcher query result isBlank importToOpenBase argument result importFile Importing user.home Unknown import format Importing in unknown format user.home Could not find a suitable import format. Format used Error opening file file file result ex importResult importResult ex argument data printer shouldShutDown lambdaimportToOpenBase0 LnetsfjabrefcliArgumentProcessor,cli,0.052132849502450035
7,cli/AuxCommandLine,net/sf/jabref/cli/AuxCommandLine,auxFile database aux auxFile database perform auxParser result subDatabase,cli,0.04600679994148418
8,cli/CrossrefFetcherEvaluator,net/sf/jabref/cli/CrossrefFetcherEvaluator,main Total DB size Total DOIs DOIs found DOIs identical New DOIs found entry parser result db entries dois doiFound doiNew doiIdentical total countDownLatch executorService reader args,cli,0.0
9,cli/GenerateCharacterTable,net/sf/jabref/cli/GenerateCharacterTable,main documentclass10pt a4paperarticle usepackageT5T1fontenc usepackageamssymb usepackageamsmath usepackagetxfonts usepackagexfrac usepackagecombelow usepackagetextcomp usepackagemathspec usepackagefontspec usepackagea4papermargin1cmgeometry usepackagesupertabular usepackagemathabx fontspecCambria DeclareTextSymbolDefaultOHORNT5 DeclareTextSymbolDefaultUHORNT5 DeclareTextSymbolDefaultohornT5 DeclareTextSymbolDefaultuhornT5 begindocument twocolumn beginsupertabularccccc No.  Uni  Symb  LaTeX  Code    hline  symbol  verb endsupertabular enddocument character args characterMap,cli,0.0
10,cli/ImportInspectionCommandLine,net/sf/jabref/cli/ImportInspectionCommandLine,entries status addEntry entry setProgress Progress 0 of 1 current max query query fetcher,cli,0.04600679994148418
11,cli/JabRefCLI,net/sf/jabref/cli/JabRefCLI,LOGGER leftOver cl Problem parsing arguments args options isHelp help isShowVersion version isBlank blank isLoadSession loads isDisableGui nogui isPreferencesExport prexp getPreferencesExport prexp jabrefprefs.xml isPreferencesImport primp getPreferencesImport primp jabrefprefs.xml isPreferencesReset prdef getPreferencesReset prdef isFileExport output getFileExport output isFileImport import getFileImport import isAuxImport aux getAuxImport aux isImportToOpenBase importToOpen getImportToOpenBase importToOpen isDebugLogging debug isFetcherEngine fetch getFetcherEngine fetch isExportMatches exportMatches getExportMatches exportMatches isGenerateBibtexKeys generateBibtexKeys isAutomaticallySetFileLinks automaticallySetFileLinks getOptions version Display version nogui No GUI. Only process command line options. help Display help on command line options blank Do not open any files at startup debug Show debug level messages import s simport format Import file filename FILE output s sexport format Output or export file filename FILE prexp Export preferences to file FILE primp Import preferences from file FILE prdef Reset preferences key1key2... or all FILE aux s s.auxs.bib Subdatabase from AUX file new FILE importToOpen Import to open tab FILE fetch Run fetcher e.g. fetchMedlinecancer FILE exportMatches FILE generateBibtexKeys Regenerate all keys for the entries in a BibTeX file asfl automaticallySetFileLinks Automatically set file links options displayVersion printUsage snsn Available import formats s sn Available export formats Please report issues at https,cli,0.045883591260810194
12,cli/SystemOutputPrinter,net/sf/jabref/cli/SystemOutputPrinter,setStatus showMessage message title msgType showMessage message,cli,0.046233208081426974
13,cli/XMPUtilMain,net/sf/jabref/cli/XMPUtilMain,main .pdf .bib Could not find BibEntry in x .pdf The given pdf does not contain any XMPmetadata. .bib .pdf Could not find BibEntry in XMP written. .bib .pdf XMP written. Could not find BibEntry in sw entry bibtexEntryWriter result entries fr meta reader result entries result bibEntry args xmpPreferences importFormatPreferences usage Read or write XMPmetadata from or to pdf file. Usage Read from PDF and print as bibtex xmpUtil pdf Read from PDF and print raw XMP xmpUtil x pdf Write the entry in bib given by key to the PDF xmpUtil key bib pdf Write all entries in bib to the PDF xmpUtil bib pdf To report bugs visit http,cli,0.0
14,collab/Change,net/sf/jabref/collab/Change,name accepted name toString isAccepted setAccepted isAcceptable description makeChange,gui,0.06109978861874853
15,collab/ChangeDisplayDialog,net/sf/jabref/collab/ChangeDisplayDialog,tree infoPanel cb rootInfo selected infoShown okPressed External changes Accept change Select the tree nodes to view and accept or reject changes Center South OK Cancel Center South localSecondary owner panel secondary root localSecondary pane infoBorder ok buttonPanel cancel isOkPressed setInfo Center comp valueChanged lambdanew2 Merged external changes allAccepted root panel localSecondary ce enumer anyDisabled lambdanew1 lambdanew0,gui,0.07175779685901143
16,collab/ChangeScanner,net/sf/jabref/collab/ChangeScanner,scanResultsResolved,gui,0.08858713164215828
17,collab/EntryAddChange,net/sf/jabref/collab/EntryAddChange,diskEntry sp Added entry diskEntry pp makeChange panel secondary undoEdit description,gui,0.07175779685901143
18,collab/EntryChange,net/sf/jabref/collab/EntryChange,entry tmpEntry field inMem onDisk tp sp FONT SIZE10H2 Modification of field I IH2 H3 Value set externally H3 H3 Value cleared externally H3 H3 Current value H3 H3 Current tmp value H3 texthtml field memEntry tmpEntry inMem onTmp onDisk text makeChange panel secondary undoEdit description,gui,0.07175779685901143
19,collab/EntryDeleteChange,net/sf/jabref/collab/EntryDeleteChange,memEntry tmpEntry sp LOGGER Deleted entry Modified entry no BibTeX key set Modified locally memEntry tmpEntry matchWithTmp isModifiedLocally pp makeChange panel secondary undoEdit description LnetsfjabrefcollabEntryDeleteChange,gui,0.07175779685901143
20,collab/FileUpdateListener,net/sf/jabref/collab/FileUpdateListener,fileUpdated fileRemoved,logic,0.09273314620947756
21,collab/FileUpdateMonitor,net/sf/jabref/collab/FileUpdateMonitor,LOGGER WAIT numberOfUpdateListener entries run FileUpdateMonitor has been interrupted. Terminating... ex ex addUpdateListener File not found ul file key hasBeenModified ex handle entry perturbTimestamp handle entry removeUpdateListener handle updateTimeStamp Couldnt update timestamp key entry getTempFile Entry not found key entry getTempFile jabref Could not create temporary file. ex temporaryFile access000 LnetsfjabrefcollabFileUpdateMonitor,logic,0.09870320316664097
22,collab/FileUpdatePanel,net/sf/jabref/collab/FileUpdatePanel,manager scanner File changed htmlcenter The fileBR0BRhas been modifiedBRexternally centerhtml Center Review changes South Center panel manager file scanner main message test getPanel componentClosing LnetsfjabrefcollabFileUpdatePanel getRescalingWeight getToggleAction actionPerformed scanResultsResolved resolved,gui,0.0884776296252953
23,collab/GroupChange,net/sf/jabref/collab/GroupChange,changedGroups tmpGroupRoot Removed all groups Modified groups tree changedGroups tmpGroupRoot makeChange Modified groups All entries child child copied panel secondary undoEdit root undo description html Accepting the change replaces the complete groups tree with the externally modified groups tree. html,gui,0.07175779685901143
24,collab/InfoPane,net/sf/jabref/collab/InfoPane,texthtml paint g2,gui,0.060849585715417556
25,collab/MetaDataChange,net/sf/jabref/collab/MetaDataChange,infoPane sp originalMetaData newMetaData Metadata change html Metadata change html originalMetaData newMetaData description makeChange panel secondary undoEdit,gui,0.07175779685901143
26,collab/PreambleChange,net/sf/jabref/collab/PreambleChange,mem disk tp sp Changed preamble FONT SIZE3H2 Changed preamble H2 H3 Value set externally H3CODE CODE H3 Value cleared externally H3 H3 Current value H3CODE CODE mem disk text makeChange panel secondary undoEdit description,gui,0.07175779685901143
27,collab/StringAddChange,net/sf/jabref/collab/StringAddChange,string tp sp LOGGER Added string HTMLH2 Added string H2H3 Label H3 H3 Content H3 HTML string makeChange Cannot add string   because the name is already in use. Error could not add string  Error could not add string   to tmp database ex ex panel secondary undoEdit description LnetsfjabrefcollabStringAddChange,gui,0.07175779685901143
28,collab/StringChange,net/sf/jabref/collab/StringChange,string mem disk label tp sp tmpString LOGGER Modified string HTMLH2 Modified string H2H3 Label H3 H3 New content H3 PI Cannot merge this change The string has been removed locally I H3 Current content H3 HTML string tmpString label mem disk sb makeChange Error could not add string  ex newId bs bs panel secondary undoEdit description LnetsfjabrefcollabStringChange,gui,0.07175779685901143
29,collab/StringNameChange,net/sf/jabref/collab/StringNameChange,string mem disk content tmpString LOGGER Renamed string string tmpString mem tmp disk content makeChange Cannot rename string   to   because the name is already in use. Error could not add string  ex newId bs newId bs panel secondary undoEdit description LnetsfjabrefcollabStringNameChange,gui,0.07175779685901143
30,collab/StringRemoveChange,net/sf/jabref/collab/StringRemoveChange,string inMem tp sp tmpString LOGGER Removed string HTMLH2 Removed string H2H3 Label H3 H3 Content H3 HTML string tmpString inMem makeChange Error could not add string  ex panel secondary undoEdit description LnetsfjabrefcollabStringRemoveChange,gui,0.07175779685901143
31,gui/BasePanel,net/sf/jabref/gui/BasePanel,run,gui,0.11563554501916624
32,gui/BasePanelMode,net/sf/jabref/gui/BasePanelMode,SHOWINGNOTHING SHOWINGPREVIEW SHOWINGEDITOR WILLSHOWEDITOR values valueOf LnetsfjabrefguiBasePanelMode name SHOWINGNOTHING SHOWINGPREVIEW SHOWINGEDITOR WILLSHOWEDITOR,gui,0.08899769339329779
33,gui/ClipBoardManager,net/sf/jabref/gui/ClipBoardManager,LOGGER CLIPBOARD lostOwnership aClipboard aContents setClipboardContents aString stringSelection getClipboardContents problem with getting clipboard contents result contents extractBibEntriesFromClipboard Could not paste this type Could not paste Found DOI in clipboard Parsed entries from clipboard text Could not parse this type Data is no longer available in the requested flavor Error while fetching contents ex ex entry bp db data ex ex ex content result LnetsfjabrefguiClipBoardManager,gui,0.10152964874732469
34,gui/DragDropPane,net/sf/jabref/gui/DragDropPane,draggingState indexDraggedTab markerPane access000 x0 access100 x0 access200 x0 access002 x0 x1 access102 x0 x1,gui,0.07211550752083001
35,gui/DragDropPopupPane,net/sf/jabref/gui/DragDropPopupPane,popupMenu menu tabRightClick access000 x0 x1,gui,0.08866868158777727
36,gui/DuplicateResolverDialog,net/sf/jabref/gui/DuplicateResolverDialog,cancel merge helpButton frame options status me Possible duplicate entries Cancel Keep merged entry only Help frame one two type Possible duplicate entries Cancel Keep merged entry only Help dialog one two type init Keep left Keep right Keep both Remove old entry Remove entry from import Keep both Old entry From import Keep left Keep right Keep both Automatically remove exact duplicates Import and remove old entry Do not import entry Import and keep old entry Old entry From import South duplicatesPosX duplicatesPosY duplicatesSizeX duplicatesSizeY both second first both second first both second first one two type both second first removeExact pw buttonPressed result getSelected getMergedEntry lambdainit5 lambdainit4 lambdainit3 lambdainit2 lambdainit1 lambdainit0 access000 x0 x1,gui,0.0
37,gui/DuplicateSearch,net/sf/jabref/gui/DuplicateSearch,panel bes duplicates bp run Searching for duplicates... Searcher duplicate removal askAboutExact cb answer be st current toRemove toAdd duplicateCounter autoRemoveExactDuplicates ce dupliC access000 x0 access100 x0 access200 x0,gui,0.0884776296252953
38,gui/EntryContainer,net/sf/jabref/gui/EntryContainer,getEntry,gui,0.07550328972558369
39,gui/EntryCustomizationDialog,net/sf/jabref/gui/EntryCustomizationDialog,actionPerformed,gui,0.0
40,gui/EntryMarker,net/sf/jabref/gui/EntryMarker,MARKCOLORLEVELS MAXMARKINGLEVEL IMPORTMARKLEVEL MARKNUMBERPATTERN markEntry markedentry markedentry markedentry markedentry markedentry prevMarkLevel prevMarkLevel markerString index be markIncrement increment ce newValue unmarkEntry markedentry markedentry markedentry markedentry markedentry markedentry toRemove prevMarkLevel markerString newValue index be onlyMaxLevel database ce unmarkOldStyle owner defaultOwner markedentry markedentry markedentry markedentry markedentry markedentry entry owner be database ce owners sb newVal isMarked markedentry markedentry ex be index shouldMarkEntries markImportedEntries,gui,0.08947300295857988
41,gui/EntryTypeDialog,net/sf/jabref/gui/EntryTypeDialog,windowClosing,gui,0.08858713164215828
42,gui/EntryTypeList,net/sf/jabref/gui/EntryTypeList,def mode Entry types Default fields mode addField enforceLegalBibtexKey Entry type names are not allowed to contain white space or the following characters Error comment The name comment cannot be used as an entry type name. Error str testString removeSelected This entry type cannot be removed. Remove entry type typeName type selected valueChanged enable entryType typeName isChanged addDefaultActionListener actionPerformed setEnabled en addListDataListener addAdditionActionListener addListSelectionListener getFields setFields getFirstSelected selectField setListSelectionMode,gui,0.0009861932938856016
43,gui/FieldSetComponent,net/sf/jabref/gui/FieldSetComponent,additionListeners list sp listModel sel input add remove up down gbl con forceLowerCase changesMade modelListeners Add Remove title fields preset arrows forceLowerCase Add Remove title fields arrows forceLowerCase Move up Move down field title fields preset addText removeText arrows forceLowerCase title1 strut fieldListFocusListener setListSelectionMode mode selectField fieldName idx viewport rectangle getFirstSelected setEnabled en setFields field modelListener fields newListModel addField enforceLegalBibtexKey Field names are not allowed to contain white space or the following characters Error str testString addFieldUncritically additionListener removeSelected selected getFields res elements addListSelectionListener addAdditionActionListener addListDataListener move dy oldIdx newInd actionPerformed comboBoxChanged src,gui,0.0019723865877712033
44,gui/FileDialog,net/sf/jabref/gui/FileDialog,fileChooser parent directory extensions parent LnetsfjabreflogicutilFileExtensions Directory must not be null parent dir withExtension singleExt withExtensions extFilter ext fileExtensions setDefaultExtension extension getFileFilter setFileFilter filter updateWorkingDirPref workingDirectory showDialogAndGetSelectedDirectory Select directory Select Select directory showDialogAndGetMultipleFiles files showDialogAndGetSelectedFile saveNewFile file showDialogAndIsAccepted getWorkingDir workingDirectory lambdasetDefaultExtension0 extension,gui,0.08460804062277057
45,gui/FindUnlinkedFilesDialog,net/sf/jabref/gui/FindUnlinkedFilesDialog,mousePressed pdf Error opening file e1 fnw userObject node row path,gui,0.0916496829281228
46,gui/GUIGlobals,net/sf/jabref/gui/GUIGlobals,LOGGER UNTITLEDTITLE currentFont TABLEICONS ENTRYEDITORLABELCOLOR ACTIVETABBEDCOLOR INACTIVETABBEDCOLOR editorTextColor validFieldBackgroundColor activeBackgroundColor invalidFieldBackgroundColor NULLFIELDCOLOR ACTIVEEDITORCOLOR WIDTHICONCOL WIDTHICONCOLRANKING MAXBACKHISTORYSIZE getTableIcon Error no table icon defined for type  fieldType label updateEntryEditorColors activeFieldEditorBackgroundColor validFieldBackgroundColor invalidFieldBackgroundColor fieldEditorTextColor init Open PDF pdf Open URL url Open CiteSeer URL citeseerurl Open ArXiv URL eprint Open DOI web link doi Open PS ps Open folder folder Open file file Open 0 file editorEMACSkeyBindings fontFamily fontStyle fontSize fileType label relevanceViewModel qualityViewModel rankViewModel priorityViewModel readViewModel printedViewModel LnetsfjabrefguiGUIGlobals untitled,gui,0.0932010447485207
47,gui/GenFieldsCustomizer,net/sf/jabref/gui/GenFieldsCustomizer,actionPerformed,gui,0.0
48,gui/GlobalFocusListener,net/sf/jabref/gui/GlobalFocusListener,focused focusGained focusLost getFocused setFocused,gui,0.09789746273262756
49,gui/IconTheme,net/sf/jabref/gui/IconTheme,FONT FONT16 DEFAULTCOLOR DEFAULTDISABLEDCOLOR DEFAULTSIZE SMALLSIZE KEYTOICON DEFAULTICONPATH imagesexternalred.png LOGGER getImage name getIconUrl icon name Could not find icon url by name so falling back on default icon imagesexternalred.png imagesexternalred.png LnetsfjabrefguiIconTheme Path must not be null for key name key path readIconThemeFile url prefix Unable to read default icon theme. index key value line in url prefix result LnetsfjabrefguiIconTheme imagesIcons.properties imagesexternal LnetsfjabrefguiIconTheme LnetsfjabrefguiIconThemeFontBasedIcon fontsmaterialdesigniconswebfont.ttf Error loading font stream,gui,0.09266533819508212
50,gui/JEditorPaneWithHighlighting,net/sf/jabref/gui/JEditorPaneWithHighlighting,LOGGER highlightPattern Highlighting not possible bad location ble highlightPattern highlighter text matcher painter getDocumentText Error while getting document text text doc text LnetsfjabrefguifieldeditorsJTextAreaWithHighlighting,gui,0.0748747503730294
51,gui/JabRefFrame,net/sf/jabref/gui/JabRefFrame,Name Manage custom exports actionPerformed ecd,gui,0.11535600703765335
52,gui/MergeDialog,net/sf/jabref/gui/MergeDialog,actionPerformed,gui,0.07172184605898187
53,gui/OSXCompatibleToolbar,net/sf/jabref/gui/OSXCompatibleToolbar,orientation name name orientation add JButton.buttonType toolbar button,gui,0.07566207687537461
54,gui/PreambleEditor,net/sf/jabref/gui/PreambleEditor,focusLost x0 x1,gui,0.0884776296252953
55,gui/PreviewPanel,net/sf/jabref/gui/PreviewPanel,LOGGER bibEntry databaseContext basePanel fixedLayout layout previewPane scrollPane printAction closeAction copyPreviewAction highlightPattern citationStyleWorker databaseContext entry panel Center panel databaseContext createKeyBindings close close close copy copy copy actionMap inputMap close copy createPopupMenu menu createPreviewPane texthtml setDatabaseContext databaseContext getBasePanel setBasePanel basePanel updateLayout cannot change the layout because the layout is fixed Preview style changed to 0 Preview style changed to 0 Preview citationStyle previewPreferences style updatePreviewLayout NEWLINE no layout could be set layoutFile sr setLayout layout setEntry newEntry listen fieldChangedEvent getEntry update sb markHighlights setPreviewLabel text scrollToTop highlightPattern newPattern getHighlightPattern setFixedLayout unknown style type parameter close getPrintAction lambdascrollToTop8 lambdasetPreviewLabel7 text lambdaupdate6 sb entry lambdasetEntry5 lambdasetEntry4 lambdasetEntry3 newEntry lambdacreatePreviewPane2 url Could not open external viewer address hyperlinkEvent lambdacreatePopupMenu1 menu lambdacreatePopupMenu0 menu access000 x0 access100 x0 access200 LnetsfjabrefguiPreviewPanel,gui,0.09295896411281027
56,gui/ReplaceStringDialog,net/sf/jabref/gui/ReplaceStringDialog,fieldsField fromField toField selOnly allFi field okPressed fieldStrings fromString toString Replace string Limit to selected entries All fields Limit to fields OK Cancel close close Replace string Strings Search for Replace with North Center South parent bg okListener ok cancelAction cancel settings am im gbl opt main con fl tl okPressed allFields selOnly replace bibtexkey bibtexkey fld be ce counter replaceField be fieldname ce txt sb ind piv counter len1 newStr lambdanew0,gui,0.08853234677410501
57,gui/SaveOrderConfigDisplay,net/sf/jabref/gui/SaveOrderConfigDisplay,panel savePriSort saveSecSort saveTerSort savePriDesc saveSecDesc saveTerDesc init bibtexkey Descending Descending Descending rightpref 8dlu fillpref 4dlu fill60dlu 4dlu leftpref pref 2dlu pref 2dlu pref Primary sort criterion Secondary sort criterion Tertiary sort criterion fieldNames allPlusKey layout builder getPanel setEnabled enabled setSaveOrderConfig saveOrderConfig getSaveOrderConfig saveOrderConfig getSelectedItemAsLowerCaseTrim sortBox,gui,0.060593376933457906
58,gui/SidePane,net/sf/jabref/gui/SidePane,PREFERREDSIZE gridBagLayout constraint mainPanel sp setComponents bx comps totalWeights remove getMaximumSize getPreferredSize,gui,0.0886419843552494
59,gui/SidePaneComponent,net/sf/jabref/gui/SidePaneComponent,close manager panel manager icon title up down tlb hideAway moveUp moveDown setActiveBasePanel panel getActiveBasePanel componentClosing componentOpening getMinimumSize getRescalingWeight getToggleAction lambdanew2 lambdanew1 lambdanew0,gui,0.07456083579881656
